listing_url,name,zipcode,smart_location,country,latitude,longitude
https://www.airbnb.com/rooms/20074443,"DUPLEX FOR STUDENTS,TRAVELLERS,BUSINESSMEN PARKING",8027,"Barcelona, Spain",Spain,41.42183,2.18882
https://www.airbnb.com/rooms/20087375,Gracia Diagonal Apartment,8006,"Barcelona, Spain",Spain,41.39821,2.15639
https://www.airbnb.com/rooms/20091067,Tranquil Double in the Heart of Bustling Old Town,8003,"Barcelona, Spain",Spain,41.38549,2.17842
https://www.airbnb.com/rooms/20115285,Stunning Sagrada Familia upto 6!!,8013,"Barcelona, Spain",Spain,41.40232,2.17788
https://www.airbnb.com/rooms/20115671,Eixample Casanova Barcelona,8036,"Barcelona, Spain",Spain,41.3877,2.15534
https://www.airbnb.com/rooms/20144403,"Room, SEA View,  Sunrise every day, Christmas tree",,"Barcelona, Spain",Spain,41.40189,2.21055
https://www.airbnb.com/rooms/20144852,Views of Sagrada Familia,8013,"Barcelona, Spain",Spain,41.40177,2.17743
https://www.airbnb.com/rooms/20153700,Room with a fantastic view,8025,"Barcelona, Spain",Spain,41.40562,2.17312
https://www.airbnb.com/rooms/20160810,Single room - Very well located,8018,"Barcelona, Spain",Spain,41.40185,2.18808
https://www.airbnb.com/rooms/20171352,Very Central Flat. Weeks or months!..,8007,"Barcelona, Spain",Spain,41.39413,2.16143
https://www.airbnb.com/rooms/20171562,Economic and comfortable room,8042,"Barcelona, Spain",Spain,41.44104,2.17403
https://www.airbnb.com/rooms/20183001,CLOSE TO THE BEACH 2 bedroom 2 bath,8005,"Barcelona, Spain",Spain,41.40225,2.20332
https://www.airbnb.com/rooms/20183259,Lujoso apartamento con terraza y tres dormitorios junto a Casa Batlló,8007,"Barcelona, Spain",Spain,41.39063,2.16336
https://www.airbnb.com/rooms/20188983,Cozy private room in the Butterfly's house,8042,"Barcelona, Spain",Spain,41.44165,2.17599
https://www.airbnb.com/rooms/20189360,Apartamento / Penthouse in the heart of Barcelona,8009,"Barcelona, Spain",Spain,41.39135,2.1671
https://www.airbnb.com/rooms/20201524,Apartamento cerca del Arco del triunfo *Bcn*,8009,"Barcelona, Spain",Spain,41.39646,2.17027
https://www.airbnb.com/rooms/20201831,Cosy and beautiful flat in the heart of Barcelona,8009,"Barcelona, Spain",Spain,41.3944,2.16641
https://www.airbnb.com/rooms/20209669,Cheap room near Port Vell and La Rambla,8004,"Barcelona, Spain",Spain,41.37342,2.169
https://www.airbnb.com/rooms/20209929,Liceo apartment by Las Ramblas,8001,"Barcelona, Spain",Spain,41.37976,2.17172
https://www.airbnb.com/rooms/20219503,Nice Room near the Beach(MarBella).Gayfriendly! :),8019,"Barcelona, Spain",Spain,41.40805,2.20906
https://www.airbnb.com/rooms/20219754,New stylish apartment up to 3,8013,"Barcelona, Spain",Spain,41.39798,2.17525
https://www.airbnb.com/rooms/20222468,Double room,8019,"Barcelona, Spain",Spain,41.41984,2.21324
https://www.airbnb.com/rooms/20225704,Near Camp Nou Stadium,8028,"Barcelona, Spain",Spain,41.37549,2.12292
https://www.airbnb.com/rooms/20239438,Bedroom in large shared appartment,,"Barcelona, Spain",Spain,41.37938,2.16387
https://www.airbnb.com/rooms/20239737,PRIVATE ROOM WITH THE BEST UBICATION IN BARCELONA,8011,"Barcelona, Spain",Spain,41.3849,2.15743
https://www.airbnb.com/rooms/20244524,Comfortable double bedroom in EXCELLENT LOCATION,,"Barcelona, Spain",Spain,41.37939,2.18075
https://www.airbnb.com/rooms/20245258,Habitación en Gracia al lado del Park Güell,8024,"Barcelona, Spain",Spain,41.4108,2.14933
https://www.airbnb.com/rooms/20259902,"Rustic, brand new close to Universitat",8001,"Barcelona, Spain",Spain,41.37974,2.16504
https://www.airbnb.com/rooms/20260320,A Private Room for 4 People,8014,"Barcelona, Spain",Spain,41.37756,2.13697
https://www.airbnb.com/rooms/20263584,Wonderful duplex with large terrace and views,8023,"Barcelona, Spain",Spain,41.4127,2.14448
https://www.airbnb.com/rooms/20264044,"Apartamento en el corazón de Gràcia, Barcelona",8012,"Barcelona, Spain",Spain,41.40601,2.15505
https://www.airbnb.com/rooms/20267424,Comfortable Double Room in Amazing Flat (H3),8008,"Barcelona, Spain",Spain,41.39211,2.15975
https://www.airbnb.com/rooms/20267826,Single Br with private bathroom,8009,"Barcelona, Spain",Spain,41.39513,2.17227
https://www.airbnb.com/rooms/20276718,Hermosa habitació 2 personas Barcelona 2 camas ó 1,8016,"Barcelona, Spain",Spain,41.4376,2.1739
https://www.airbnb.com/rooms/20278477,El Borne,8003,"Barcelona, Spain",Spain,41.38525,2.17995
https://www.airbnb.com/rooms/20282841,Cozy artsy  & next to La rambla,8001,"Barcelona, Spain",Spain,41.38541,2.16783
https://www.airbnb.com/rooms/20283593,Centric room in Sagrada Familia,8013,"Barcelona, Spain",Spain,41.40201,2.17631
https://www.airbnb.com/rooms/20296783,ALQUILO HABITACIÓN A HUÉSPEDES,8014,"Barcelona, Spain",Spain,41.37472,2.14406
https://www.airbnb.com/rooms/20298786,Sofia&Marina's hostel,8025,"Barcelona, Spain",Spain,41.40908,2.17475
https://www.airbnb.com/rooms/20315947,"Private room and private bathroom, Borne!",8003,"Barcelona, Spain",Spain,41.3838,2.18146
https://www.airbnb.com/rooms/20316182,"Room close to Sagrada Familia, in shared flat",8041,"Barcelona, Spain",Spain,41.4157,2.17665
https://www.airbnb.com/rooms/20320007,Room in Eixample,8037,"Barcelona, Spain",Spain,41.39749,2.16571
https://www.airbnb.com/rooms/20320182,City Center Studio Gracia 6,8012,"Barcelona, Spain",Spain,41.40003,2.15867
https://www.airbnb.com/rooms/20325056,MINI LOFT IN BARCELONA CENTER,8002,"Barcelona, Spain",Spain,41.38387,2.17325
https://www.airbnb.com/rooms/20325080,Nice quiet room near Plaza de Sants,8014,"Barcelona, Spain",Spain,41.37322,2.13622
https://www.airbnb.com/rooms/20329120,Interior room in a nice centric apartment /,,"Barcelona, Spain",Spain,41.37447,2.15587
https://www.airbnb.com/rooms/20329292,Habitación cerca Diagonal Mar y CCIB,8019,"Barcelona, Spain",Spain,41.41226,2.21404
https://www.airbnb.com/rooms/20353402,Lovely 2bed/3bath in the heart of Eixample,8009,"Barcelona, Spain",Spain,41.39427,2.17156
https://www.airbnb.com/rooms/20357039,Vintage and lovely at Universitat,8001,"Barcelona, Spain",Spain,41.37939,2.16374
https://www.airbnb.com/rooms/20374256,Luxury Apartment in Eixample II,8009,"Barcelona, Spain",Spain,41.3938,2.1723
https://www.airbnb.com/rooms/20378869,Bright double bedroom in El Born,8003,"Barcelona, Spain",Spain,41.38356,2.18231
https://www.airbnb.com/rooms/20399080,Habitación doble Sagrada Familia,8013,"Barcelona, Spain",Spain,41.40414,2.17718
https://www.airbnb.com/rooms/20400093,HABITACION COLOR CREMA,8027,"Barcelona, Spain",Spain,41.42294,2.18145
https://www.airbnb.com/rooms/20411235,Habitación en El Raval ( Con Aire Acondicionado ),8001,"Barcelona, Spain",Spain,41.37692,2.16992
https://www.airbnb.com/rooms/20411255,Bright room in the center of Barcelona,8002,"Barcelona, Spain",Spain,41.38472,2.1749
https://www.airbnb.com/rooms/20430800,Barcelona 1 doble habitacion en el parque güell,8035,"Barcelona, Spain",Spain,41.4224,2.15119
https://www.airbnb.com/rooms/20431369,Habitación tranquila,8012,"Barcelona, Spain",Spain,41.39947,2.15408
https://www.airbnb.com/rooms/20433601,Habitación exterior y bien comunicada,8024,"Barcelona, Spain",Spain,41.40906,2.15537
https://www.airbnb.com/rooms/20435206,Comoda y amplia habitacion individual exterior,8026,"Barcelona, Spain",Spain,41.41522,2.18251
https://www.airbnb.com/rooms/20445562,SOL &* Only 1 * person 1 *bed  1 *room!!,8028,"Barcelona, Spain",Spain,41.37398,2.12536
https://www.airbnb.com/rooms/20449499,brand new luxury apartment in fron HOSPITAL CLINIC,8029,"Barcelona, Spain",Spain,41.38616,2.15227
https://www.airbnb.com/rooms/20464646,Bright & cozy apartment at the beach,8003,"Barcelona, Spain",Spain,41.37554,2.18979
https://www.airbnb.com/rooms/20465466,Habitación sencilla en sagrada familia.,8025,"Barcelona, Spain",Spain,41.40536,2.17039
https://www.airbnb.com/rooms/20480105,perfect room,8016,"Barcelona, Spain",Spain,41.4348,2.17683
https://www.airbnb.com/rooms/20486543,DELUXE THREE BEDROOM APARTMENT,8036,"Barcelona, Spain",Spain,41.39253,2.15182
https://www.airbnb.com/rooms/20489402,HABITACIÓN EL RINCÓN DEL ARTE,8022,"Barcelona, Spain",Spain,41.40363,2.13403
https://www.airbnb.com/rooms/20489907,Comfortable room close to Parc Guel and Metro line,8023,"Barcelona, Spain",Spain,41.41421,2.14557
https://www.airbnb.com/rooms/20494772,La Belle Èpoque B,8005,"Barcelona, Spain",Spain,41.39574,2.1932
https://www.airbnb.com/rooms/20496703,OCEAN ROOM,,"Barcelona, Spain",Spain,41.4088,2.18697
https://www.airbnb.com/rooms/20512030,Perfect Room For Friends (H2),8008,"Barcelona, Spain",Spain,41.39212,2.15953
https://www.airbnb.com/rooms/20512516,COZY & NICE APPARTMENT IN BCN,8015,"Barcelona, Spain",Spain,41.38107,2.14869
https://www.airbnb.com/rooms/20534305,"Beautiful bedroom & private bathroom, Born, centre",8003,"Barcelona, Spain",Spain,41.38445,2.17919
https://www.airbnb.com/rooms/20534796,Bonito apartamento a 5´ de la playa,8005,"Barcelona, Spain",Spain,41.40322,2.20887
https://www.airbnb.com/rooms/20546515,"Alcudia, 2 bedroom, wide kitchen and a balcony",8016,"Barcelona, Spain",Spain,41.43493,2.175
https://www.airbnb.com/rooms/20548782,Sweet room in an artistic apartment,8028,"Barcelona, Spain",Spain,41.37775,2.12747
https://www.airbnb.com/rooms/20565417,Double room.  Сenter of Barcelona.,8009,"Barcelona, Spain",Spain,41.39796,2.16791
https://www.airbnb.com/rooms/20565464,Private Double Room Barcelona (near Arc de Triomf),8013,"Barcelona, Spain",Spain,41.39698,2.18221
https://www.airbnb.com/rooms/20583255,Amazing 4 bedroom apartment near Plaza Glories,8018,"Barcelona, Spain",Spain,41.40878,2.19232
https://www.airbnb.com/rooms/20587251,Bungalow au cœur d'un jardin,8024,"Barcelona, Spain",Spain,41.41429,2.16478
https://www.airbnb.com/rooms/20600010,Can carme,8024,"Barcelona, Spain",Spain,41.41121,2.14865
https://www.airbnb.com/rooms/20600604,Precioso apartamento en Villa de Gracia,8012,"Barcelona, Spain",Spain,41.40165,2.16202
https://www.airbnb.com/rooms/20611485,"Cómoda Habitación L'Eixample, Gracia",8029,"Barcelona, Spain",Spain,41.3859,2.14405
https://www.airbnb.com/rooms/20611995,.Warehouse: The Loft,8018,"Barcelona, Spain",Spain,41.39646,2.19189
https://www.airbnb.com/rooms/20617286,Modern DoubleRoom next to LaRambla*****,8002,"Barcelona, Spain",Spain,41.38529,2.17246
https://www.airbnb.com/rooms/20617528,Комната в престижном районе Барселоны 7,8006,"Barcelona, Spain",Spain,41.39533,2.14813
https://www.airbnb.com/rooms/20626518,Beautiful & Central flat near Sagrada Familia,8037,"Barcelona, Spain",Spain,41.40067,2.17064
https://www.airbnb.com/rooms/20629159,Habitación doble muy cerca de la Sagrada Familia,8025,"Barcelona, Spain",Spain,41.40574,2.17015
https://www.airbnb.com/rooms/20635258,Habitación doble en Sagrada Familia,8013,"Barcelona, Spain",Spain,41.3995,2.17825
https://www.airbnb.com/rooms/20644525,Chambre privée pour 2,8015,"Barcelona, Spain",Spain,41.37596,2.16209
https://www.airbnb.com/rooms/20651405,Original Duplex in the center of Barcelona,8002,"Barcelona, Spain",Spain,41.38092,2.18102
https://www.airbnb.com/rooms/20659449,Bright apartment in the heart of Barcelona,8009,"Barcelona, Spain",Spain,41.39833,2.16976
https://www.airbnb.com/rooms/20684385,TERRACE 15 minutes from the center,8028,"Barcelona, Spain",Spain,41.37689,2.12669
https://www.airbnb.com/rooms/20686033,"Downtown Beautiful, cosy double room.",8015,"Barcelona, Spain",Spain,41.37527,2.15307
https://www.airbnb.com/rooms/20696075,DOUBLE room - In the HEART of BARCELONA,8002,"Barcelona, Spain",Spain,41.3805,2.17651
https://www.airbnb.com/rooms/20702001,Comfy double room with private bathroom @ Poblenou,8018,"Barcelona, Spain",Spain,41.40689,2.20029
https://www.airbnb.com/rooms/20719000,Duplex en el centro de Barcelona,8001,"Barcelona, Spain",Spain,41.3772,2.1715
https://www.airbnb.com/rooms/20719301,Apartamento de 2 dormitorios en centro de BCN (I),8001,"Barcelona, Spain",Spain,41.37865,2.17306
https://www.airbnb.com/rooms/20724731,Cousy and sunny!!!,8019,"Barcelona, Spain",Spain,41.41378,2.2182
https://www.airbnb.com/rooms/20726054,IDEAL,8027,"Barcelona, Spain",Spain,41.42522,2.18693
https://www.airbnb.com/rooms/20737649,Toller Stadt und Meerblick 5*,8042,"Barcelona, Spain",Spain,41.44276,2.1668
https://www.airbnb.com/rooms/20738888,"In ""Barceloneta""  3m walking away from the beach",8007,"Barcelona, Spain",Spain,41.39282,2.16654
https://www.airbnb.com/rooms/20754360,Cozy double room near Barcelona stadium,8028,"Barcelona, Spain",Spain,41.37997,2.13271
https://www.airbnb.com/rooms/20754781,Double room in cosy appartment in Poble Sec,8004,"Barcelona, Spain",Spain,41.37104,2.16081
https://www.airbnb.com/rooms/20760285,Habitación doble al lado de Sagrada Familia,8013,"Barcelona, Spain",Spain,41.40147,2.18192
https://www.airbnb.com/rooms/20761840,Acogedora habitación Doble / Nice double room,8028,"Barcelona, Spain",Spain,41.37565,2.12536
https://www.airbnb.com/rooms/20778861,Casa Tibidabo with Terrace + Wifi,8023,"Barcelona, Spain",Spain,41.40974,2.13998
https://www.airbnb.com/rooms/20778866,Habitación doble y luminosa en el barrio del Borne,8003,"Barcelona, Spain",Spain,41.38394,2.1803
https://www.airbnb.com/rooms/20793112,Casa Tamarita near Park Güell,8023,"Barcelona, Spain",Spain,41.41124,2.13945
https://www.airbnb.com/rooms/20796632,Double room with private bathroom Pza Espanya,8015,"Barcelona, Spain",Spain,41.37647,2.15157
https://www.airbnb.com/rooms/20800393,Double room in the core of the modernist Barcelona,,"Barcelona, Spain",Spain,41.3948,2.15837
https://www.airbnb.com/rooms/20800414,Comfortable double room in a good location.,8026,"Barcelona, Spain",Spain,41.41648,2.18804
https://www.airbnb.com/rooms/20809200,BCN center / balcony - ensuite bathroom,8003,"Barcelona, Spain",Spain,41.3848,2.18275
https://www.airbnb.com/rooms/20810449,"Casals, near the metro, city center and the beach",8003,"Barcelona, Spain",Spain,41.38029,2.18811
https://www.airbnb.com/rooms/20823382,QUIET DOUBLE ROOM and PERFECT LOCATION,8027,"Barcelona, Spain",Spain,41.42247,2.18804
https://www.airbnb.com/rooms/20824583,Habitación en el centro de Barcelona!,8001,"Barcelona, Spain",Spain,41.37954,2.1663
https://www.airbnb.com/rooms/20840058,Double room in Plaza Espanya,8015,"Barcelona, Spain",Spain,41.37528,2.15081
https://www.airbnb.com/rooms/20840468,Hab.doble Privada Por Noche,8027,"Barcelona, Spain",Spain,41.42744,2.17989
https://www.airbnb.com/rooms/20842239,SANT ANTONI 1 APARTMENT,8015,"Barcelona, Spain",Spain,41.37842,2.1608
https://www.airbnb.com/rooms/20842240,BARCELONA FIRA 5,8004,"Barcelona, Spain",Spain,41.37451,2.15723
https://www.airbnb.com/rooms/20844664,Gorgeous Suite Room w/balcony next Paseo de Gracia,8007,"Barcelona, Spain",Spain,41.39104,2.16333
https://www.airbnb.com/rooms/20846051,Greatplace!,8030,"Barcelona, Spain",Spain,41.44366,2.18829
https://www.airbnb.com/rooms/20855888,Preciosa suite con increibles vistas,8002,"Barcelona, Spain",Spain,41.38352,2.1779
https://www.airbnb.com/rooms/20856955,Born beach side studio apartment,8003,"Barcelona, Spain",Spain,41.38459,2.18481
https://www.airbnb.com/rooms/20862382,Studio in the Gotic,8002,"Barcelona, Spain",Spain,41.37891,2.17706
https://www.airbnb.com/rooms/20866492,Sagrada familia lll,8025,"Barcelona, Spain",Spain,41.40575,2.175
https://www.airbnb.com/rooms/20883020,FAMILIAR,,"Barcelona, Spain",Spain,41.41179,2.16871
https://www.airbnb.com/rooms/20885917,Barcelona Centre for a Long-Term Stay,8003,"Barcelona, Spain",Spain,41.38877,2.17997
https://www.airbnb.com/rooms/20901527,Sagrada Familia lovely room,8037,"Barcelona, Spain",Spain,41.40014,2.16771
https://www.airbnb.com/rooms/20909137,Sunlight C | Luminosa estancia privada Barcelona,8038,"Barcelona, Spain",Spain,41.36554,2.13708
https://www.airbnb.com/rooms/20923280,Cozy apartment next to the beach,8003,"Barcelona, Spain",Spain,41.37942,2.19206
https://www.airbnb.com/rooms/20923328,Art Gallery Apartment 1A,8004,"Barcelona, Spain",Spain,41.37483,2.16216
https://www.airbnb.com/rooms/20940035,H5 - Suite in Amazing Flat (private bathroom + AC),8008,"Barcelona, Spain",Spain,41.39239,2.16127
https://www.airbnb.com/rooms/20940814,Habitacion privada cerca de playa y metro.,8003,"Barcelona, Spain",Spain,41.38158,2.18881
https://www.airbnb.com/rooms/20946113,Apartment San Martin,8020,"Barcelona, Spain",Spain,41.41561,2.20652
https://www.airbnb.com/rooms/20950570,1 sleeper place in shared room!,8020,"Barcelona, Spain",Spain,41.41988,2.21107
https://www.airbnb.com/rooms/20953485,Beautiful Triple Room 5 min from La Rambla*****2B,8001,"Barcelona, Spain",Spain,41.37998,2.16715
https://www.airbnb.com/rooms/20954351,Room In The Centre ( LA RAMBLA ) + Private Balcony,8002,"Barcelona, Spain",Spain,41.38057,2.17393
https://www.airbnb.com/rooms/20964105,1 sleeper place in shared room!,8020,"Barcelona, Spain",Spain,41.42133,2.21123
https://www.airbnb.com/rooms/20964440,1 sleeper place in shared room!,8020,"Barcelona, Spain",Spain,41.41964,2.21028
https://www.airbnb.com/rooms/20965155,2 sleeper placea for 2 persons in shared room!,8020,"Barcelona, Spain",Spain,41.41949,2.20986
https://www.airbnb.com/rooms/20965167,2 sleeper placea for 2 persons in shared room!,8020,"Barcelona, Spain",Spain,41.41985,2.21079
https://www.airbnb.com/rooms/20974127,Double Bed Room! Free Coffee :),8002,"Barcelona, Spain",Spain,41.3843,2.17308
https://www.airbnb.com/rooms/20975411,"CASA PRIVADA CON HABITACION  CERCA LA PLAYA,METRO.",8003,"Barcelona, Spain",Spain,41.38204,2.18709
https://www.airbnb.com/rooms/20987534,"Cozy, single, room",,"Barcelona, Spain",Spain,41.42354,2.17805
https://www.airbnb.com/rooms/20987601,InSuite Room in Poblenou,8005,"Barcelona, Spain",Spain,41.40021,2.20594
https://www.airbnb.com/rooms/21002036,Soak up the Sun with Unbeatable Views of the Sagrada Familia,8025,"Barcelona, Spain",Spain,41.40232,2.17058
https://www.airbnb.com/rooms/21002245,QUITE ROOM with CHURCH VIEWS & COFFEE !,,"Barcelona, Spain",Spain,41.38411,2.17202
https://www.airbnb.com/rooms/21010261,"Nice, spacoius double room",8032,"Barcelona, Spain",Spain,41.42662,2.16979
https://www.airbnb.com/rooms/21017486,Single room with two beds,8032,"Barcelona, Spain",Spain,41.42658,2.16932
https://www.airbnb.com/rooms/21036809,Llinars Cozy Flat gay friendly,8030,"Barcelona, Spain",Spain,41.43604,2.20698
https://www.airbnb.com/rooms/21040938,LUNA*-private room !#sharefrienandfamily's 3 beds!,8028,"Barcelona, Spain",Spain,41.37274,2.12621
https://www.airbnb.com/rooms/21050572,Double room with balcony in Barcelona centre,8002,"Barcelona, Spain",Spain,41.38333,2.17435
https://www.airbnb.com/rooms/21053310,Room for 1 in the center of Barcelona. Urgell,8011,"Barcelona, Spain",Spain,41.38008,2.16278
https://www.airbnb.com/rooms/21055878,Superior Triple  Room,8025,"Barcelona, Spain",Spain,41.40569,2.17181
https://www.airbnb.com/rooms/21056115,Romantic room for two! | CR,,"Barcelona, Spain",Spain,41.41549,2.19163
https://www.airbnb.com/rooms/21087216,Double bedroom in calm area,8014,"Barcelona, Spain",Spain,41.37374,2.14528
https://www.airbnb.com/rooms/21087262,Piso con encanto bien situado,8014,"Barcelona, Spain",Spain,41.37464,2.14234
https://www.airbnb.com/rooms/21100627,Nice and spacious room in the centre,8011,"Barcelona, Spain",Spain,41.38783,2.1599
https://www.airbnb.com/rooms/21101179,Lovely Bedroom in the Born district,8003,"Barcelona, Spain",Spain,41.3905,2.17947
https://www.airbnb.com/rooms/21106255,Selvita Interior en Barcelona,8021,"Barcelona, Spain",Spain,41.39794,2.14441
https://www.airbnb.com/rooms/21109833,Cozy room next to Sagrada Familia,8025,"Barcelona, Spain",Spain,41.40748,2.17794
https://www.airbnb.com/rooms/21130291,Habitación con terraza y mucha luz en el centro.,8029,"Barcelona, Spain",Spain,41.38455,2.15105
https://www.airbnb.com/rooms/21131979,"METRO FIRA, ATTICO NUOVO E LUMINOSISSIMO",8038,"Barcelona, Spain",Spain,41.35183,2.14167
https://www.airbnb.com/rooms/21158097,"Sunny room in a penthouse, near city center.",8003,"Barcelona, Spain",Spain,41.39032,2.18037
https://www.airbnb.com/rooms/21159463,Room for 2  in unique El Born Apartment (181),8003,"Barcelona, Spain",Spain,41.38403,2.18391
https://www.airbnb.com/rooms/21174796,Habitación doble a minutos de la sagrada familia.,8025,"Barcelona, Spain",Spain,41.40338,2.17001
https://www.airbnb.com/rooms/21177159,A quiet modern apartment in the heart of Barcelona,8003,"Barcelona, Spain",Spain,41.38923,2.17633
https://www.airbnb.com/rooms/21186102,"Apartamento en Barceloneta, reformado a estrenar.",8003,"Barcelona, Spain",Spain,41.37646,2.19081
https://www.airbnb.com/rooms/21194339,Apartment close to Sagrada Familia,8026,"Barcelona, Spain",Spain,41.40604,2.18447
https://www.airbnb.com/rooms/21198179,MODERNISM AND LUXURY IN BARCELONA CENTER,8007,"Barcelona, Spain",Spain,41.39048,2.15921
https://www.airbnb.com/rooms/21198930,Nice Bedroom in the Sagrada Familia Neighborhood,,"Barcelona, Spain",Spain,41.40739,2.17701
https://www.airbnb.com/rooms/21202872,Boqueria Market Private spacious room,8001,"Barcelona, Spain",Spain,41.38048,2.17077
https://www.airbnb.com/rooms/21203242,Suite BigBed & private bathroom near SagFamilia,8026,"Barcelona, Spain",Spain,41.40743,2.18516
https://www.airbnb.com/rooms/21214815,Relax in a Colorful Apartment in the Central City,8014,"Barcelona, Spain",Spain,41.37942,2.13666
https://www.airbnb.com/rooms/21220019,A Bright room next to La Sagrada Familia,8013,"Barcelona, Spain",Spain,41.40528,2.18002
https://www.airbnb.com/rooms/21227930,Habitación privada en pleno centro con mucha luz!!,8001,"Barcelona, Spain",Spain,41.38063,2.16952
https://www.airbnb.com/rooms/21228124,Three rooms with terrace for 4 persons,8032,"Barcelona, Spain",Spain,41.4268,2.16992
https://www.airbnb.com/rooms/21238607,Bedroom Sagrada Familia,8013,"Barcelona, Spain",Spain,41.40386,2.17808
https://www.airbnb.com/rooms/21239593,SUPERB ROOM WITH PRIVATE SHOWER & FREE COFFEE,8005,"Barcelona, Spain",Spain,41.40301,2.19919
https://www.airbnb.com/rooms/21257656,Flat with a spectacular view!,,"Barcelona, Spain",Spain,41.40538,2.1627
https://www.airbnb.com/rooms/21257859,Hermosa y Cómoda habitación! Ideal para parejas!,8023,"Barcelona, Spain",Spain,41.40977,2.14661
https://www.airbnb.com/rooms/21273683,Habitación privada con salón y balcón Rambla Raval,8001,"Barcelona, Spain",Spain,41.37863,2.17019
https://www.airbnb.com/rooms/21273705,"Luminous, Fancy Room & Private living / Center Bcn",,"Barcelona, Spain",Spain,41.37949,2.16771
https://www.airbnb.com/rooms/21290246,Stylish flat near Plaza Catalunya,,"Barcelona, Spain",Spain,41.39034,2.1769
https://www.airbnb.com/rooms/21295247,Siéntete en tu casa en El Centro de Barcelona,,"Barcelona, Spain",Spain,41.3977,2.16867
https://www.airbnb.com/rooms/21307144,"SF22 LET'S EAT CALÇOTS IN JANUARY, SAGRADA FAMILIA",8025,"Barcelona, Spain",Spain,41.40234,2.17256
https://www.airbnb.com/rooms/21307242,fdl3 BEST PRICE! SEVERAL HAPPY APARTMENTS EL BORN!,8003,"Barcelona, Spain",Spain,41.38482,2.17879
https://www.airbnb.com/rooms/21310631,Habitación luminosa con balcón - 1km de la playa.,8005,"Barcelona, Spain",Spain,41.40209,2.19785
https://www.airbnb.com/rooms/21311663,.Nice Apartment in Barcelona city,,"Barcelona, Spain",Spain,41.42946,2.18403
https://www.airbnb.com/rooms/21322869,Habitación acogedora en zona muy tranquila,8035,"Barcelona, Spain",Spain,41.42339,2.14653
https://www.airbnb.com/rooms/21324655,Happy place,8019,"Barcelona, Spain",Spain,41.41557,2.21651
https://www.airbnb.com/rooms/21344289,Private double room near to sants station & metros,8028,"Barcelona, Spain",Spain,41.37192,2.13184
https://www.airbnb.com/rooms/21344868,Double Room in the heart of Barcelona,8001,"Barcelona, Spain",Spain,41.37953,2.17093
https://www.airbnb.com/rooms/21360005,habitacion comoda 29,8028,"Barcelona, Spain",Spain,41.37762,2.12628
https://www.airbnb.com/rooms/21360339,Single room luminous Sagrada Familia WIFI new Flat,,"Barcelona, Spain",Spain,41.41021,2.18218
https://www.airbnb.com/rooms/21365130,Acogedora habitación individual/ Single bedroom,8028,"Barcelona, Spain",Spain,41.3757,2.12326
https://www.airbnb.com/rooms/21366324,Habitación privada en piso cómodo a 15’ del centro,8027,"Barcelona, Spain",Spain,41.41331,2.19095
https://www.airbnb.com/rooms/21380863,Central and Local House In Lively Gracia,8037,"Barcelona, Spain",Spain,41.40196,2.16551
https://www.airbnb.com/rooms/21381752,Single Bedroom near Pl. España,8015,"Barcelona, Spain",Spain,41.37849,2.15032
https://www.airbnb.com/rooms/21389652,Deluxe Suite room w/balcony & AC next to La Rambla,8002,"Barcelona, Spain",Spain,41.38357,2.17292
https://www.airbnb.com/rooms/21390908,DELUXE THREE BEDROOM APARTMENT,8036,"Barcelona, Spain",Spain,41.3938,2.15199
https://www.airbnb.com/rooms/21390935,SUPERIOR 4 BEDROOM APARTMENT,8036,"Barcelona, Spain",Spain,41.39214,2.15326
https://www.airbnb.com/rooms/21390937,SUPERIOR 4 BEDROOM APARTMENT,8036,"Barcelona, Spain",Spain,41.39234,2.15339
https://www.airbnb.com/rooms/21393712,Tapioles II - 2 bedroom apartment,8004,"Barcelona, Spain",Spain,41.37255,2.16471
https://www.airbnb.com/rooms/21396298,Cozy Single Bedroom in Barcelona,,"Barcelona, Spain",Spain,41.39619,2.15635
https://www.airbnb.com/rooms/21402659,Superior Deluxe One Bedroom Apartment,8003,"Barcelona, Spain",Spain,41.38475,2.1843
https://www.airbnb.com/rooms/21402716,"Two beds. LUXURY, POOL, BEACH, GYM. CCIB",8019,"Barcelona, Spain",Spain,41.40808,2.215
https://www.airbnb.com/rooms/21408803,Premium Designer Living with a Stunning Rooftop,8014,"Barcelona, Spain",Spain,41.38009,2.13723
https://www.airbnb.com/rooms/21409342,Acogedor piso en Barrio Gótico,8002,"Barcelona, Spain",Spain,41.38659,2.17467
https://www.airbnb.com/rooms/21421927,"Spacious, centrical and lightning flat",8011,"Barcelona, Spain",Spain,41.387,2.16052
https://www.airbnb.com/rooms/21421940,The best room in love,8027,"Barcelona, Spain",Spain,41.42307,2.19246
