listing_url,name,zipcode,smart_location,country,latitude,longitude
https://www.airbnb.com/rooms/18666,Flat with Sunny Terrace,8026,"Barcelona, Spain",Spain,41.40889,2.18555
https://www.airbnb.com/rooms/31958,"Gaudi Attic 1, Friendly Rentals",8024,"Barcelona, Spain",Spain,41.4095,2.15938
https://www.airbnb.com/rooms/32471,"Gaudi Attic 2, Friendly Rentals",8024,"Barcelona, Spain",Spain,41.40928,2.16112
https://www.airbnb.com/rooms/35392,Double 01 CasanovaRooms Barcelona,8036,"Barcelona, Spain",Spain,41.39075,2.15072
https://www.airbnb.com/rooms/36763,In front of the beach,8003,"Barcelona, Spain",Spain,41.37906,2.19141
https://www.airbnb.com/rooms/61444,Bright apartment - Rambla Catalunya (HUTB-005863),8007,"Barcelona, Spain",Spain,41.38901,2.16552
https://www.airbnb.com/rooms/66037,Great apartment in  en el Born,8003,"Barcelona, Spain",Spain,41.38322,2.18234
https://www.airbnb.com/rooms/71553,"Winter Holidays PROMOTIONS, apt with terrace!",8013,"Barcelona, Spain",Spain,41.3974,2.17682
https://www.airbnb.com/rooms/71603,MODERNIST PENTHOUSE. 1bedroom apt with terrace,8010,"Barcelona, Spain",Spain,41.39038,2.17606
https://www.airbnb.com/rooms/73683,Sagrada Familia area for 12 people,8025,"Barcelona, Spain",Spain,41.40506,2.17081
https://www.airbnb.com/rooms/73692,Rustic apartment : Rambla Catalunya (HUTB-005863),8007,"Barcelona, Spain",Spain,41.39108,2.16521
https://www.airbnb.com/rooms/80004,Parc Montjuic HUTB (Phone number hidden by Airbnb),8004,"Barcelona, Spain",Spain,41.37188,2.16656
https://www.airbnb.com/rooms/83283,★PLAZA ©ATALUÑA ®oom x2 + private bath®oom+wifi,8011,"Barcelona, Spain",Spain,41.38227,2.16141
https://www.airbnb.com/rooms/100256,"BARCELONA CENTRO EN LA PLAYA ,WIFI",8003,"Barcelona, Spain",Spain,41.37983,2.19249
https://www.airbnb.com/rooms/107437,A beautiful  villa in Barcelona,8017,"Barcelona, Spain",Spain,41.42864,2.09159
https://www.airbnb.com/rooms/130227,Spacious Room with Pool and Terrace,8019,"Barcelona, Spain",Spain,41.40646,2.21282
https://www.airbnb.com/rooms/135513,APARTMENT AT RAMBLA POBLE NOU AND BEACH,8005,"Barcelona, Spain",Spain,41.39841,2.20613
https://www.airbnb.com/rooms/154437,Charming room  Diagonal wifi 100 Mb,8036,"Barcelona, Spain",Spain,41.39106,2.1509
https://www.airbnb.com/rooms/158238,CENTRAL Wi Fi  w/TERRASSE 8 people,8014,"Barcelona, Spain",Spain,41.38416,2.13636
https://www.airbnb.com/rooms/171816,Sagrada Familia Clot Vista,8026,"Barcelona, Spain",Spain,41.40828,2.18622
https://www.airbnb.com/rooms/179619,Affordable Barcelona for you!,8014,"Barcelona, Spain",Spain,41.37151,2.13607
https://www.airbnb.com/rooms/186540,Fully equipped loft near Sagrada Familia,8026,"Barcelona, Spain",Spain,41.41076,2.19078
https://www.airbnb.com/rooms/186542,Lovely and sunny double room in BCN,8009,"Barcelona, Spain",Spain,41.39326,2.17386
https://www.airbnb.com/rooms/194460,Double Private room with breakfast near the beach,8019,"Barcelona, Spain",Spain,41.41431,2.21686
https://www.airbnb.com/rooms/195092,Bonitas vistas de Barcelona,8024,"Barcelona, Spain",Spain,41.41026,2.15623
https://www.airbnb.com/rooms/206122,Amazing Loft in BCN Center (B0132),8009,"Barcelona, Spain",Spain,41.3984,2.15801
https://www.airbnb.com/rooms/206167,"BRIGHT, COMFY AND CENTRAL",8004,"Barcelona, Spain",Spain,41.37406,2.16524
https://www.airbnb.com/rooms/213368,Lovely room Barcelona up 2 people,8024,"Barcelona, Spain",Spain,41.413,2.159
https://www.airbnb.com/rooms/213581,Room Centric + Personal Dressing,8003,"Barcelona, Spain",Spain,41.38818,2.17571
https://www.airbnb.com/rooms/234375,ATTIC VIEWS SAGRADA FAMILIA,8013,"Barcelona, Spain",Spain,41.39918,2.1752
https://www.airbnb.com/rooms/237895,Room w/ lots of LIGHT & INCREDIBLE Views!,8013,"Barcelona, Spain",Spain,41.39895,2.183
https://www.airbnb.com/rooms/252232,Nice apartment with POOL BARCELONA,8020,"Barcelona, Spain",Spain,41.41531,2.20069
https://www.airbnb.com/rooms/254811,Large double bedroom brand new apartment in Born,8003,"Barcelona, Spain",Spain,41.38595,2.18238
https://www.airbnb.com/rooms/264125,Sagrada Familia 5' Metro WIFI fibre,8025,"Barcelona, Spain",Spain,41.41242,2.17624
https://www.airbnb.com/rooms/264621,Amore Aragon free WiFi- HUTB 007051,8009,"Barcelona, Spain",Spain,41.397,2.17229
https://www.airbnb.com/rooms/268417,Cozy Room near the Center. 2 línes underg.Eixample,8015,"Barcelona, Spain",Spain,41.37687,2.14979
https://www.airbnb.com/rooms/269467,Sunny and quiet Loft next to Sagrada Familia,8013,"Barcelona, Spain",Spain,41.40338,2.17685
https://www.airbnb.com/rooms/275336,Charming 3BR just off Gran Via,8015,"Barcelona, Spain",Spain,41.38294,2.15728
https://www.airbnb.com/rooms/275346,Sunny terrace penthouse by Camp Nou Free Nespresso,8034,"Barcelona, Spain",Spain,41.3924,2.12314
https://www.airbnb.com/rooms/279439,sociable apartment in Raval 3,8001,"Barcelona, Spain",Spain,41.37889,2.17314
https://www.airbnb.com/rooms/281978,Big Private Room - Paseo de Gracia,8009,"Barcelona, Spain",Spain,41.39111,2.16677
https://www.airbnb.com/rooms/290592,Views SagradaFamilia + metro + WIFI,8025,"Barcelona, Spain",Spain,41.41087,2.17644
https://www.airbnb.com/rooms/295200,Gaudi view´s Attic with private terrace,8024,"Barcelona, Spain",Spain,41.40771,2.15987
https://www.airbnb.com/rooms/315769,Sagrada Familia vintage apartment,8025,"Barcelona, Spain",Spain,41.40577,2.17324
https://www.airbnb.com/rooms/318865,A penthouse two terraces in Gracia,8012,"Barcelona, Spain",Spain,41.40048,2.158
https://www.airbnb.com/rooms/330766,Urquinaona Charming and Centric,8010,"Barcelona, Spain",Spain,41.39074,2.17306
https://www.airbnb.com/rooms/330957,Central 3 bedroom beautiful APT,8009,"Barcelona, Spain",Spain,41.39831,2.17174
https://www.airbnb.com/rooms/343622,Spacious loft nearby pl. España ,8014,"Barcelona, Spain",Spain,41.3765,2.14385
https://www.airbnb.com/rooms/343859,LOVELY 2 BD WIFI GRACIA,,"Barcelona, Spain",Spain,41.40004,2.16318
https://www.airbnb.com/rooms/352772,Elegant Centric Attic WIFI Car Park ,8015,"Barcelona, Spain",Spain,41.38084,2.15047
https://www.airbnb.com/rooms/353640,Great Apartment in Heart of Born,8003,"Barcelona, Spain",Spain,41.38109,2.17855
https://www.airbnb.com/rooms/364030,"Amazing views, centric apt w/terrac",8015,"Barcelona, Spain",Spain,41.3756,2.16127
https://www.airbnb.com/rooms/365147,"Sunny double room, central location",8015,"Barcelona, Spain",Spain,41.37818,2.15967
https://www.airbnb.com/rooms/378998,PRECIOSA Y ACOGEDORA HABITACIÓN ,8031,"Barcelona, Spain",Spain,41.42618,2.17423
https://www.airbnb.com/rooms/379868,INCREDIBLE VIEW front Sagrada Familia+PRIV.BALCONY,8025,"Barcelona, Spain",Spain,41.40642,2.17093
https://www.airbnb.com/rooms/384464,Paseo de Gracia / Plaza Catalunya,8007,"Barcelona, Spain",Spain,41.38855,2.16942
https://www.airbnb.com/rooms/384867,A PERFECT DOUBLE ROOM  BCN CENTER,8011,"Barcelona, Spain",Spain,41.38777,2.16252
https://www.airbnb.com/rooms/401990,LARGE ROOM in a COOL STREET!!,,"Barcelona, Spain",Spain,41.38962,2.16137
https://www.airbnb.com/rooms/402633,BARCELONA CITY CENTRE CHARM,8004,"Barcelona, Spain",Spain,41.37424,2.17044
https://www.airbnb.com/rooms/414786,Centric Double Room-Paseo de Gracia,8009,"Barcelona, Spain",Spain,41.39154,2.16766
https://www.airbnb.com/rooms/415848,"2 br, walking distance to ev-thing Cozy Space",8029,"Barcelona, Spain",Spain,41.38323,2.14396
https://www.airbnb.com/rooms/430585,Beautiful apartment in the heart of the Gothic,8002,"Barcelona, Spain",Spain,41.37841,2.17479
https://www.airbnb.com/rooms/431331,NEW APARTMENT IN GRACIA NEIGBOURHOO,8012,"Barcelona, Spain",Spain,41.40098,2.15514
https://www.airbnb.com/rooms/440427,Just Next to Sagrada Familia!!!,8013,"Barcelona, Spain",Spain,41.40254,2.17689
https://www.airbnb.com/rooms/440840,sociable rooms in Raval 2,8001,"Barcelona, Spain",Spain,41.38012,2.17106
https://www.airbnb.com/rooms/449854,Center location. Magic terrace. 360º views,8003,"Barcelona, Spain",Spain,41.38807,2.17922
https://www.airbnb.com/rooms/451758,"Bright, elegant loft in center town",8001,"Barcelona, Spain",Spain,41.38201,2.16618
https://www.airbnb.com/rooms/462062,CLOSE TO LA FIRA PL ESPAÑA /INCL BRKFAST,8015,"Barcelona, Spain",Spain,41.37973,2.15158
https://www.airbnb.com/rooms/462332,Cozy Single Room Barcelona Center,8015,"Barcelona, Spain",Spain,41.37878,2.15197
https://www.airbnb.com/rooms/471669,El Poblenou* House @ Barcelona,8005,"Barcelona, Spain",Spain,41.39832,2.19995
https://www.airbnb.com/rooms/472062,close to Paseo de Gracia.,8012,"Barcelona, Spain",Spain,41.39852,2.16159
https://www.airbnb.com/rooms/475786,Room to rent in beautiful apartment,8023,"Barcelona, Spain",Spain,41.41101,2.1465
https://www.airbnb.com/rooms/477256,lightful apartment in poblenou',8018,"Barcelona, Spain",Spain,41.40065,2.19487
https://www.airbnb.com/rooms/484390,MONTHLY COZY SUNNY - SAGRADA FAM.,8013,"Barcelona, Spain",Spain,41.40227,2.17517
https://www.airbnb.com/rooms/485011,A Super unique/charming/hip room!,8010,"Barcelona, Spain",Spain,41.3914,2.17889
https://www.airbnb.com/rooms/492963,Habitaciones de matrimonio  con balcon!,8041,"Barcelona, Spain",Spain,41.41592,2.17341
https://www.airbnb.com/rooms/493122,lightful apartment in poblenou,8018,"Barcelona, Spain",Spain,41.40018,2.19436
https://www.airbnb.com/rooms/504653,Double bed in Plaza España,8004,"Barcelona, Spain",Spain,41.36985,2.14287
https://www.airbnb.com/rooms/504860,Double room in Plaza España,8004,"Barcelona, Spain",Spain,41.37113,2.14468
https://www.airbnb.com/rooms/510923,Lovely Penthouse in Barcelona,8027,"Barcelona, Spain",Spain,41.42255,2.18061
https://www.airbnb.com/rooms/511739,sf41 NEW 2 BDR FLAT SAGRADA FAMILIA,8025,"Barcelona, Spain",Spain,41.40238,2.17082
https://www.airbnb.com/rooms/516102,Barcelona International Stop !!!,8015,"Barcelona, Spain",Spain,41.38083,2.14678
https://www.airbnb.com/rooms/516340,Paseo de Gracia/Plaza Catalunya I,8007,"Barcelona, Spain",Spain,41.39033,2.16812
https://www.airbnb.com/rooms/522705,"MODERN FLAT, BIG TERRACE BCN CENTER",8009,"Barcelona, Spain",Spain,41.39672,2.16975
https://www.airbnb.com/rooms/522987,"Room,  Bikes and views! DOBLE",8013,"Barcelona, Spain",Spain,41.39968,2.1817
https://www.airbnb.com/rooms/529106,Centric and Complete,8010,"Barcelona, Spain",Spain,41.3914,2.17603
https://www.airbnb.com/rooms/531195,Bright four bedroom apartment with balconies,8015,"Barcelona, Spain",Spain,41.37513,2.16751
https://www.airbnb.com/rooms/539349,habitación para 1 o 2 personas,8016,"Barcelona, Spain",Spain,41.4357,2.17562
https://www.airbnb.com/rooms/543342,Gran Vía Apartment Catalunya square,8011,"Barcelona, Spain",Spain,41.38385,2.16033
https://www.airbnb.com/rooms/546970,Tendency Sagrada Familia 2-2,8025,"Barcelona, Spain",Spain,41.40418,2.17246
https://www.airbnb.com/rooms/547027,Tendency Sagrada Familia 3-1,8025,"Barcelona, Spain",Spain,41.40201,2.1722
https://www.airbnb.com/rooms/551314,Tendency Sagrada Familia P-1,8025,"Barcelona, Spain",Spain,41.40335,2.17251
https://www.airbnb.com/rooms/551339,Tendency Sagrada Familia P-2,8025,"Barcelona, Spain",Spain,41.40325,2.17156
https://www.airbnb.com/rooms/557772,Modern-ist Apartment,8036,"Barcelona, Spain",Spain,41.38957,2.15568
https://www.airbnb.com/rooms/558366,Single room: morning sun + lots of light in Born,8003,"Barcelona, Spain",Spain,41.38593,2.18416
https://www.airbnb.com/rooms/562169,Two rooms in beautiful apartment.,8032,"Barcelona, Spain",Spain,41.42226,2.17435
https://www.airbnb.com/rooms/562807,Large apartment in Paralelo,8004,"Barcelona, Spain",Spain,41.37334,2.15895
https://www.airbnb.com/rooms/568129,Nice room in the heart of Barcelona,8015,"Barcelona, Spain",Spain,41.38214,2.15563
https://www.airbnb.com/rooms/568185,Comfortable and centrally  room,8015,"Barcelona, Spain",Spain,41.38336,2.15395
https://www.airbnb.com/rooms/572833,In the heart of Gracia,8012,"Barcelona, Spain",Spain,41.4001,2.15641
https://www.airbnb.com/rooms/575139,Art Nouveau Luxury Apartment BCN,8001,"Barcelona, Spain",Spain,41.3846,2.16689
https://www.airbnb.com/rooms/578558,Ca'l Mateu-Sagrada Familia,8020,"Barcelona, Spain",Spain,41.39786,2.18067
https://www.airbnb.com/rooms/582364,Spectacular Modern Uptown Duplex,8023,"Barcelona, Spain",Spain,41.40914,2.1465
https://www.airbnb.com/rooms/590032,Chambre centrique/plage Barcelona,8003,"Barcelona, Spain",Spain,41.3843,2.17989
https://www.airbnb.com/rooms/590503,Cozy apartment  perfect situation - metro & WIFI,8037,"Barcelona, Spain",Spain,41.39954,2.17111
https://www.airbnb.com/rooms/600162,Enjoy! Cozy penthouse ideal for couples.,8031,"Barcelona, Spain",Spain,41.42846,2.16918
https://www.airbnb.com/rooms/600590,COSY QUIET front Sagrada Familia! PERFECT LOCATION,8025,"Barcelona, Spain",Spain,41.40569,2.17175
https://www.airbnb.com/rooms/619728,Atico Sagrada Familia,8013,"Barcelona, Spain",Spain,41.40138,2.17807
https://www.airbnb.com/rooms/619775,Modern and functional apartment near the beach,8005,"Barcelona, Spain",Spain,41.40279,2.20987
https://www.airbnb.com/rooms/630566,modern sunny Attic with pool&garden close to beach,8005,"Barcelona, Spain",Spain,41.405,2.2009
https://www.airbnb.com/rooms/630810,059. Paseo de Gracia 5 Estrellas 11,8008,"Barcelona, Spain",Spain,41.39563,2.16447
https://www.airbnb.com/rooms/637232,1,8020,"Барселона, Spain",Spain,41.41235,2.19816
https://www.airbnb.com/rooms/638009,Barcelona/Poblenou: Sun & Culture,8018,"Barcelona, Spain",Spain,41.40074,2.19445
https://www.airbnb.com/rooms/640268,**Nice  and relax Couple Room** ,8015,"Barcelona, Spain",Spain,41.38082,2.15246
https://www.airbnb.com/rooms/641402,Attic Suite to let  in Barcelona,8028,"Barcelona, Spain",Spain,41.37531,2.13029
https://www.airbnb.com/rooms/645513,"BEACH ,ATTIC APARTMENT TERRACE !",8005,"Barcelona, Spain",Spain,41.39698,2.20116
https://www.airbnb.com/rooms/648112,New room  Barcelona city center,8029,"Barcelona, Spain",Spain,41.38148,2.14399
https://www.airbnb.com/rooms/662879,CENTRAL AND CHARMING FLAT,8004,"Barcelona, Spain",Spain,41.37418,2.15747
https://www.airbnb.com/rooms/663096,★ GAUDI LUXURY by Cocoon Barcelona,8007,"Barcelona, Spain",Spain,41.38971,2.16594
https://www.airbnb.com/rooms/667181,Private Double Room with Jacuzzi,8033,"Barcelona, Spain",Spain,41.45554,2.18395
https://www.airbnb.com/rooms/667762,ROOM WTH TERRACE IN GASPATX B&B,8031,"Barcelona, Spain",Spain,41.43944,2.15769
https://www.airbnb.com/rooms/671951,NEAR RAMBLA POBLENOU AND BEACH,8018,"Barcelona, Spain",Spain,41.40494,2.19887
https://www.airbnb.com/rooms/672728,Nice apartment in Napols Street BCN,8013,"Barcelona, Spain",Spain,41.39857,2.17709
https://www.airbnb.com/rooms/677012,HABITACION INDIVIDUAL  BARCELONA,8023,"Barcelona, Spain",Spain,41.40836,2.14911
https://www.airbnb.com/rooms/677850,Sunny and charming centric flat!!,8018,"Barcelona, Spain",Spain,41.39125,2.18364
https://www.airbnb.com/rooms/683062,Sunny and charming centric flat!!,8018,"Barcelona, Spain",Spain,41.39152,2.18313
https://www.airbnb.com/rooms/683195,"Penthouse loft-wifi-terrace, Gracia",8012,"Barcelona, Spain",Spain,41.40164,2.1635
https://www.airbnb.com/rooms/688703,"""EL MOLINO"" Paral.lel -near ramblas",8004,"Barcelona, Spain",Spain,41.37353,2.1684
https://www.airbnb.com/rooms/688946,Nice Renovated Apartment - El Clot,8018,"Barcelona, Spain",Spain,41.41012,2.19294
https://www.airbnb.com/rooms/699927,Nice studio in Gràcia,8024,"Barcelona, Spain",Spain,41.40731,2.1557
https://www.airbnb.com/rooms/700150,Luxury 2 bed suite with courtyard in city-centre,8007,"Barcelona, Spain",Spain,41.38609,2.16609
https://www.airbnb.com/rooms/717710,Central Loft Plaza Espanya center,8015,"Barcelona, Spain",Spain,41.38019,2.14559
https://www.airbnb.com/rooms/718469,Sagrada Familia-wifi-2rooms-air con,8013,"Barcelona, Spain",Spain,41.40498,2.17988
https://www.airbnb.com/rooms/721478,1 Sicilia Superior Apartment 4 bedrooms,8013,"Barcelona, Spain",Spain,41.39969,2.17735
https://www.airbnb.com/rooms/721479,2 Sicilia Superior Apartment 4 bedrooms,8013,"Barcelona, Spain",Spain,41.39947,2.17645
https://www.airbnb.com/rooms/722100,Cozy Queen S. bedroom w/priv bath,8015,"Barcelona, Spain",Spain,41.37517,2.16768
https://www.airbnb.com/rooms/722742,Quiet apartment with terrace-Gracia,8006,"Barcelona, Spain",Spain,41.39851,2.15535
https://www.airbnb.com/rooms/729078,In the heart of Barcelona,8001,"Barcelona, Spain",Spain,41.37768,2.17262
https://www.airbnb.com/rooms/730467,2 bdr Apartment nearby La Ramblas,8015,"Barcelona, Spain",Spain,41.37598,2.16293
https://www.airbnb.com/rooms/735587,Charming Bedroom on GASPATX B&b,8031,"Barcelona, Spain",Spain,41.44001,2.15943
https://www.airbnb.com/rooms/735620,charming double room in Gaspatx B&B,8031,"Barcelona, Spain",Spain,41.4398,2.15789
https://www.airbnb.com/rooms/740362,"Bedroom in a big house with ""patio""",8019,"Barcelona, Spain",Spain,41.41316,2.20759
https://www.airbnb.com/rooms/742820,Excellent Flat in Sagrada Familia,8013,"Barcelona, Spain",Spain,41.40523,2.17893
https://www.airbnb.com/rooms/750066,Stylish apartment in the heart of Sant Antoni,8015,"Barcelona, Spain",Spain,41.37608,2.16362
https://www.airbnb.com/rooms/753322,Big beautiful apartment in Gracia 4 rooms,8012,"Barcelona, Spain",Spain,41.39985,2.15715
https://www.airbnb.com/rooms/758925,Great room in nice environment,8012,"Barcelona, Spain",Spain,41.40337,2.15487
https://www.airbnb.com/rooms/759351,ÁTICO CON TERRAZA PLAZA ESPAÑA  REGISTRO HUTB00428,8014,"Barcelona, Spain",Spain,41.37212,2.14657
https://www.airbnb.com/rooms/763465,Very Nice Room to rent in Raval ,8001,"Barcelona, Spain",Spain,41.379,2.16562
https://www.airbnb.com/rooms/764452,☀︎Sunny.♡Couple's (Website hidden by Airbnb) friendly,8018,"Barcelona, Spain",Spain,41.40016,2.19542
https://www.airbnb.com/rooms/773802,CITY TRIP - Para 10 personas !!!!,8037,"Barcelona, Spain",Spain,41.40345,2.16586
https://www.airbnb.com/rooms/773886,Discover the Real Barcelona from an Apartment in Gracia,8024,"Barcelona, Spain",Spain,41.40589,2.15976
https://www.airbnb.com/rooms/777527,Plaza España,8015,"Barcelona, Spain",Spain,41.37645,2.16363
https://www.airbnb.com/rooms/777538,(ESQ) Spacious apart in Born Art,8003,"Barcelona, Spain",Spain,41.38463,2.17933
https://www.airbnb.com/rooms/790404,"(P2) Cozy flat,  LA PEDRERA Gaudí",8012,"Barcelona, Spain",Spain,41.40349,2.15931
https://www.airbnb.com/rooms/790475,"(P1) Cozy apart, Gracia LA PEDRERA",8012,"Barcelona, Spain",Spain,41.39872,2.15855
https://www.airbnb.com/rooms/796809,POBLENOU BEACH BCN FALL OFFERS 70E,8005,"Barcelona, Spain",Spain,41.39798,2.20426
https://www.airbnb.com/rooms/799240,STAYS UP TO 32 DAYS- STUDIO CITY CENTER,8015,"Barcelona, Spain",Spain,41.37574,2.16502
https://www.airbnb.com/rooms/804268,New VINTAGE LOFT in a quiet area with garden,8005,"Barcelona, Spain",Spain,41.39469,2.19372
https://www.airbnb.com/rooms/810278,WIFI room in Barcelona full CENTER,8002,"Barcelona, Spain",Spain,41.37925,2.17687
https://www.airbnb.com/rooms/814154,Portal del Angel 3,8002,"Barcelona, Spain",Spain,41.38417,2.17248
https://www.airbnb.com/rooms/814172,Mar Bella 3 Barcelonastuff Apartment,8005,"Barcelona, Spain",Spain,41.40356,2.20606
https://www.airbnb.com/rooms/820629,Habitación doble para mujer estudiante/trabajadora,8023,"Barcelona, Spain",Spain,41.41812,2.14772
https://www.airbnb.com/rooms/821100,Central-2 Big Bedrooms-View--Lift,8015,"Barcelona, Spain",Spain,41.37651,2.16261
https://www.airbnb.com/rooms/832516,OFFER ROOM IN ATTIC NEAR PLZ ESPAÑA,8014,"Barcelona, Spain",Spain,41.36987,2.13834
https://www.airbnb.com/rooms/832755,AMAZING BOUTIQUE APARTMENT. AN OASIS IN BARCELONA,8018,"Barcelona, Spain",Spain,41.40322,2.19858
https://www.airbnb.com/rooms/839655,Chic 2 bedroom with balcony close to Rambla,8015,"Barcelona, Spain",Spain,41.37612,2.16398
https://www.airbnb.com/rooms/839805,MEDITERRANEAN TERRACE,8019,"Barcelona, Spain",Spain,41.40383,2.2143
https://www.airbnb.com/rooms/843612,Single room in the city center,8007,"Barcelona, Spain",Spain,41.38768,2.16723
https://www.airbnb.com/rooms/846363,Bedroom with private bathroom,8018,"Barcelona, Spain",Spain,41.39051,2.18315
https://www.airbnb.com/rooms/849035,Atic with Terrace in CENTER,8010,"Barcelona, Spain",Spain,41.39115,2.17989
https://www.airbnb.com/rooms/849839,AVINYO B APARTMENT,8002,"Barcelona, Spain",Spain,41.37974,2.17986
https://www.airbnb.com/rooms/853731,Near Sagrada Familia-Cozy.lift.WiFi,8037,"Barcelona, Spain",Spain,41.39961,2.16739
https://www.airbnb.com/rooms/856159,Room for rent near the beach.,8005,"Barcelona, Spain",Spain,41.40303,2.19948
https://www.airbnb.com/rooms/859813,Penthouse with a view of La Sagrada,8013,"Barcelona, Spain",Spain,41.4004,2.1762
https://www.airbnb.com/rooms/859884,Gothic Doble Room private bathroom,8002,"Barcelona, Spain",Spain,41.38036,2.1796
https://www.airbnb.com/rooms/864681,Luxury stateroom in town heart,8009,"Barcelona, Spain",Spain,41.39463,2.16839
https://www.airbnb.com/rooms/865148,Grande I Apartment on Valencia St.,8009,"Barcelona, Spain",Spain,41.39909,2.17019
https://www.airbnb.com/rooms/867893,Apartment next to Montjuïc B,8004,"Barcelona, Spain",Spain,41.37258,2.16298
https://www.airbnb.com/rooms/868198,Grande II apartment on Valencia St.,8009,"Barcelona, Spain",Spain,41.39761,2.17017
https://www.airbnb.com/rooms/876101,Fabulous apartment sea view,,"Barcelona, Spain",Spain,41.39096,2.19959
https://www.airbnb.com/rooms/877884,Elegant Apart.with parking included HUTB-004588,8029,"Barcelona, Spain",Spain,41.38588,2.15062
https://www.airbnb.com/rooms/883382,"Penthouse, Terrace & BBQ, Park Guell, Bus and Metr",8032,"Barcelona, Spain",Spain,41.42,2.15798
https://www.airbnb.com/rooms/884420,Apartament near Camp Nou (Barça),8028,"Barcelona, Spain",Spain,41.37837,2.12207
https://www.airbnb.com/rooms/892906,Enjoy a good location for your stay :),8009,"Barcelona, Spain",Spain,41.39494,2.17114
https://www.airbnb.com/rooms/892922,AMAZING AP. TERRIFIC LOCATION LUXURY PL.CATALUNYA,8007,"Barcelona, Spain",Spain,41.38832,2.16938
https://www.airbnb.com/rooms/893399,"NEW APARTMENT, NEAR TO THE BEACH WITH PARKING",8019,"Barcelona, Spain",Spain,41.41036,2.20169
https://www.airbnb.com/rooms/895091,SPECTACULAR Five Senses Apartment,8036,"Barcelona, Spain",Spain,41.38676,2.15525
https://www.airbnb.com/rooms/901211,Apt Granandos 4 in the center,8008,"Barcelona, Spain",Spain,41.38976,2.15856
https://www.airbnb.com/rooms/902403,Perfect apartment just at Downtown,8010,"Barcelona, Spain",Spain,41.391,2.17263
https://www.airbnb.com/rooms/910349,BRIGHT ROOM in POBLE SEC,8004,"Barcelona, Spain",Spain,41.37323,2.16136
https://www.airbnb.com/rooms/912414,Cozy Apartment near to Plaza España,8014,"Barcelona, Spain",Spain,41.37485,2.14631
https://www.airbnb.com/rooms/919483,Spectacular apartment with terrace,8004,"Barcelona, Spain",Spain,41.37407,2.16863
https://www.airbnb.com/rooms/922906,Centric apart perfect families 2.2,8004,"Barcelona, Spain",Spain,41.37376,2.16871
https://www.airbnb.com/rooms/927535,"HABITACION SINGLE EN GRACIA, BARCEL",8023,"Barcelona, Spain",Spain,41.40617,2.15032
https://www.airbnb.com/rooms/927680,Sagrada Familia area for 17 people,8013,"Barcelona, Spain",Spain,41.39925,2.18031
https://www.airbnb.com/rooms/933877,Gracia! Single room 45€ /double 90€,8025,"Barcelona, Spain",Spain,41.40524,2.16554
https://www.airbnb.com/rooms/934979,Sagrada Familia charming,8013,"Barcelona, Spain",Spain,41.40223,2.17517
https://www.airbnb.com/rooms/936900,Penthouse in Gran Via (Pl.Espanya),8004,"Barcelona, Spain",Spain,41.36847,2.1432
https://www.airbnb.com/rooms/937331,Downtown 15min.walking Pl.Catalunya,8008,"Barcelona, Spain",Spain,41.39358,2.15462
https://www.airbnb.com/rooms/938497,Private Room Balcony - Double Bed,8004,"Barcelona, Spain",Spain,41.38393,2.16018
https://www.airbnb.com/rooms/938611,Private Room - Central - Double Bed,8004,"Barcelona, Spain",Spain,41.38375,2.16081
https://www.airbnb.com/rooms/942410,Diagonal APARTMENT,8018,"Barcelona, Spain",Spain,41.40667,2.19547
https://www.airbnb.com/rooms/942574,Habitación junto a La Rambla,8002,"Barcelona, Spain",Spain,41.38376,2.17792
https://www.airbnb.com/rooms/947269,Colourful & Central Flat-WIFI,8015,"Barcelona, Spain",Spain,41.38023,2.15543
https://www.airbnb.com/rooms/950784,"Single Room near Ramblas, Breakfast",8007,"Barcelona, Spain",Spain,41.38577,2.16499
https://www.airbnb.com/rooms/956768,Central Flat near Sagrada Família and Metro,8013,"Barcelona, Spain",Spain,41.40158,2.17431
https://www.airbnb.com/rooms/957402,Nice apart. close to Fira Montjuic,8004,"Barcelona, Spain",Spain,41.37149,2.15155
https://www.airbnb.com/rooms/960275,Nice Room in Ciutadella July&August,8005,"Barcelona, Spain",Spain,41.39178,2.18825
https://www.airbnb.com/rooms/961548,Apartment with terrace in Gracia,8012,"Barcelona, Spain",Spain,41.40434,2.15291
https://www.airbnb.com/rooms/965681,Executive Cataluña 2 - 3 Bedrooms,8011,"Barcelona, Spain",Spain,41.38542,2.16177
https://www.airbnb.com/rooms/965712,Executive Cataluña 3.  3 Bedrooms,8011,"Barcelona, Spain",Spain,41.38507,2.16128
https://www.airbnb.com/rooms/972024,4 BED+10 PEOPLE+MODERN+CITY CENTER,8007,"Barcelona, Spain",Spain,41.38594,2.16732
https://www.airbnb.com/rooms/973013,5 min Sagrada Familia y metro. Wifi,8025,"Barcelona, Spain",Spain,41.41066,2.17702
https://www.airbnb.com/rooms/979073,Silent flat Gracia & Sagr. Familia,8037,"Barcelona, Spain",Spain,41.40272,2.16443
https://www.airbnb.com/rooms/979914,Bright 130 metre Apt +40m Furnished Terrace,8015,"Barcelona, Spain",Spain,41.3815,2.15877
https://www.airbnb.com/rooms/986015,FANTASTIC apartment in Barcelona,8012,"Barcelona, Spain",Spain,41.39889,2.16004
https://www.airbnb.com/rooms/986101,Cosy apartment next to Montjuic !,8004,"Barcelona, Spain",Spain,41.37335,2.17157
https://www.airbnb.com/rooms/987773,DOUBLE ROOM INDEPENDENT + BALCONY,8023,"Barcelona, Spain",Spain,41.41127,2.14652
https://www.airbnb.com/rooms/988755,Nice Apartment in Barcelona,8021,"Barcelona, Spain",Spain,41.39342,2.14602
