listing_url,name,zipcode,smart_location,country,latitude,longitude
https://www.airbnb.com/rooms/25824514,Spacious & quiet 4 Bedroom apartment!! HUTB-012568,8029,"Barcelona, Spain",Spain,41.38693,2.13481
https://www.airbnb.com/rooms/25825122,Awesome apartment & amazing terrace! HUTB-012684,8029,"Barcelona, Spain",Spain,41.38615,2.13685
https://www.airbnb.com/rooms/25828056,BARCELONA DIVINA,8004,"Barcelona, Spain",Spain,41.37182,2.15862
https://www.airbnb.com/rooms/25828168,Super bright and spacious flat in the city center,8007,"Barcelona, Spain",Spain,41.38999,2.16659
https://www.airbnb.com/rooms/25832349,City Center up to 6! NEW,8011,"Barcelona, Spain",Spain,41.38526,2.16333
https://www.airbnb.com/rooms/25832582,Lovely & cozy double room in the heart of BCN,8015,"Barcelona, Spain",Spain,41.38266,2.15698
https://www.airbnb.com/rooms/25841442,Friendly loft in the center of Brcelona,8003,"Barcelona, Spain",Spain,41.3888,2.17578
https://www.airbnb.com/rooms/25841695,Giant room in perfect location,8011,"Barcelona, Spain",Spain,41.38377,2.15856
https://www.airbnb.com/rooms/25853373,Habitación Museo Sant Pau,8025,"Barcelona, Spain",Spain,41.4098,2.17518
https://www.airbnb.com/rooms/25853699,Habitación Paseo Gaudi,8025,"Barcelona, Spain",Spain,41.40974,2.17639
https://www.airbnb.com/rooms/25864115,SPACIOUS TWO BEDS ROOM POBLE SEC CLOSE TO AIROPORT,8004,"Barcelona, Spain",Spain,41.37232,2.16152
https://www.airbnb.com/rooms/25866698,Beautiful room in a luxury apartment City center,8011,"Barcelona, Spain",Spain,41.38613,2.15899
https://www.airbnb.com/rooms/25888727,Best location bedroom with bathroom insuite,8006,"Barcelona, Spain",Spain,41.39785,2.15602
https://www.airbnb.com/rooms/25892061,Private Room/Bathroom next to Placa Catalunya!,8002,"Barcelona, Spain",Spain,41.38599,2.17317
https://www.airbnb.com/rooms/25907045,60 sq.mt. flat or 2 studios with 2 bathroom all in,8012,"Barcelona, Spain",Spain,41.38532,2.15667
https://www.airbnb.com/rooms/25908691,Piso en barrio de Gràcia y al lado del Parc Güell,8024,"Barcelona, Spain",Spain,41.40818,2.15087
https://www.airbnb.com/rooms/25927581,Amazing Sunny apartment next to Passeig de Gracia,8006,"Barcelona, Spain",Spain,41.39551,2.15794
https://www.airbnb.com/rooms/25927824,Sagrada Familia 14,8025,"Barcelona, Spain",Spain,41.4057,2.17211
https://www.airbnb.com/rooms/25929001,COZY STUDIO IN THE HEART OF BORN,8003,"Barcelona, Spain",Spain,41.38321,2.1823
https://www.airbnb.com/rooms/25929291,Singel Room,8026,"Barcelona, Spain",Spain,41.41611,2.18254
https://www.airbnb.com/rooms/25937200,City Center Vintage Apartment 2,8015,"Barcelona, Spain",Spain,41.38317,2.15449
https://www.airbnb.com/rooms/25939940,Cosy double room Barcelona center,8001,"Barcelona, Spain",Spain,41.3824,2.16573
https://www.airbnb.com/rooms/25947230,The Big Room! Near Plaza Catalunya 444,8007,"Barcelona, Spain",Spain,41.38651,2.16191
https://www.airbnb.com/rooms/25952623,"Céntrico , encantador, comodo",8011,"Barcelona, Spain",Spain,41.3852,2.16282
https://www.airbnb.com/rooms/25959890,Piso modernista en Zona Alta de Barcelona,8022,"Barcelona, Spain",Spain,41.40384,2.13473
https://www.airbnb.com/rooms/25960520,Fco Giner Gracia - 3 bedroom apartment,8012,"Barcelona, Spain",Spain,41.40016,2.1599
https://www.airbnb.com/rooms/25972657,Cozy Double Room with Balcony on Sagrada Familia!,,"Barcelona, Spain",Spain,41.40371,2.17648
https://www.airbnb.com/rooms/25975671,Coqueto y cómodo estudio en  Gracia,8024,"Barcelona, Spain",Spain,41.40777,2.15868
https://www.airbnb.com/rooms/25989485,Fifth and luxury penthouse high area Barcelona,8034,"Barcelona, Spain",Spain,41.39294,2.11265
https://www.airbnb.com/rooms/25990834,"Magical apartment near the beach, Poblenou area",8005,"Barcelona, Spain",Spain,41.39482,2.19884
https://www.airbnb.com/rooms/25996399,Room in the city center-  Plaza Cataluña,8002,"Barcelona, Spain",Spain,41.38431,2.17316
https://www.airbnb.com/rooms/25996813,Sagrada Familia Apartment 265,8025,"Barcelona, Spain",Spain,41.40683,2.16852
https://www.airbnb.com/rooms/26008194,Sagrada Familia Apartment,8013,"Barcelona, Spain",Spain,41.39883,2.17482
https://www.airbnb.com/rooms/26008844,DUPLEX DELUX APARTMENT SAGRADA FAMILIA,8013,"Barcelona, Spain",Spain,41.39985,2.17331
https://www.airbnb.com/rooms/26024567,Design Double ensuite room in Sagrada Familia,8013,"Barcelona, Spain",Spain,41.40143,2.17486
https://www.airbnb.com/rooms/26025302,Three Bed Room with private bathroom in Sagrada Familia,8013,"Barcelona, Spain",Spain,41.40067,2.17389
https://www.airbnb.com/rooms/26029744,Lovely 1 bedroom apartment in the city center BCN,8001,"Barcelona, Spain",Spain,41.37863,2.17161
https://www.airbnb.com/rooms/26030039,Double / triple Comfortable room Ramblas Barcelona,8001,"Barcelona, Spain",Spain,41.3836,2.16965
https://www.airbnb.com/rooms/26043915,Apartment M.Claret,8025,"Barcelona, Spain",Spain,41.40924,2.17331
https://www.airbnb.com/rooms/26048239,"LOFT!!!, Walk Everywhere!!",8001,"Barcelona, Spain",Spain,41.37506,2.16786
https://www.airbnb.com/rooms/26057523,200m2 of apartment in Barcelona center,8011,"Barcelona, Spain",Spain,41.3831,2.15983
https://www.airbnb.com/rooms/26058907,HABITACIÓN DOBLE PRIVADA CON TERRAZA,8031,"Barcelona, Spain",Spain,41.42949,2.16795
https://www.airbnb.com/rooms/26068814,Double room with large balcony and sunny terrace,8016,"Barcelona, Spain",Spain,41.42827,2.17843
https://www.airbnb.com/rooms/26071271,Blackandwhitehome Gracia 1 2,8012,"Barcelona, Spain",Spain,41.40586,2.15235
https://www.airbnb.com/rooms/26081253,Habitación Amplia Cerca de la Sagrada Familia,8026,"Barcelona, Spain",Spain,41.41196,2.1779
https://www.airbnb.com/rooms/26083596,ATTIC WITH AMAZING VIEWS NEAR PASEO DE GRACIA,8015,"Barcelona, Spain",Spain,41.37951,2.15447
https://www.airbnb.com/rooms/26096710,Habitación naranja muy confortable,8042,"Barcelona, Spain",Spain,41.44236,2.17424
https://www.airbnb.com/rooms/26100858,···DOUBLE-PRIVATE ROOM AND NICE ROOMIES,8015,"Barcelona, Spain",Spain,41.37617,2.16555
https://www.airbnb.com/rooms/26114499,Plaza España room to rent,8014,"Barcelona, Spain",Spain,41.37059,2.144
https://www.airbnb.com/rooms/26114542,Tiny Double Room,8011,"Barcelona, Spain",Spain,41.38401,2.16347
https://www.airbnb.com/rooms/26118914,2-Atico dúplex con  terraza muy centrico,8011,"Barcelona, Spain",Spain,41.38091,2.1611
https://www.airbnb.com/rooms/26120284,Blackandwhitehome Poble Nou Attic I,8005,"Barcelona, Spain",Spain,41.40255,2.20117
https://www.airbnb.com/rooms/26141985,Apartamento con encanto en Gracia,8012,"Barcelona, Spain",Spain,41.40207,2.16385
https://www.airbnb.com/rooms/26143740,5' to Sagrada Familia :),8013,"Barcelona, Spain",Spain,41.40445,2.1796
https://www.airbnb.com/rooms/26161180,Habitación en Barcelona,8016,"Barcelona, Spain",Spain,41.42992,2.18092
https://www.airbnb.com/rooms/26166669,Barcelona Horta,8035,"Barcelona, Spain",Spain,41.43229,2.14978
https://www.airbnb.com/rooms/26180735,Rambla del Poblenou near the beach (4pax) Mar1,8005,"Barcelona, Spain",Spain,41.39748,2.20513
https://www.airbnb.com/rooms/26181888,"Sagrada Familia cozy place, 2-1",8025,"Barcelona, Spain",Spain,41.40369,2.17276
https://www.airbnb.com/rooms/26191713,Smart 1 bedroom flat with views,8002,"Barcelona, Spain",Spain,41.38366,2.1778
https://www.airbnb.com/rooms/26191909,Apartamento luminoso y centrico en Barcelona,,"Barcelona, Spain",Spain,41.37965,2.16363
https://www.airbnb.com/rooms/26212168,"3 Rooms Apartment, Ronda Univeristat",8007,"BARCELONA, Spain",Spain,41.3902,2.16939
https://www.airbnb.com/rooms/26212312,1 Bedroom Apartment Passeig de Gracia,8007,"BARCELONA, Spain",Spain,41.38858,2.16846
https://www.airbnb.com/rooms/26212659,CALM TWO-TERRACE APARTMENT (BHM2-2747),8024,"Barcelona, Spain",Spain,41.41618,2.16231
https://www.airbnb.com/rooms/26212962,NEW! Cozy apartment with terrace in Sants,8014,"Barcelona, Spain",Spain,41.37425,2.13795
https://www.airbnb.com/rooms/26223665,Linda Habitación individual (PLAZA ESPAÑA),8015,"Barcelona, Spain",Spain,41.37771,2.15271
https://www.airbnb.com/rooms/26225096,Narella,8013,"Barcelona, Spain",Spain,41.40167,2.18367
https://www.airbnb.com/rooms/26241260,Piso grande Modernista D,8001,"Barcelona, Spain",Spain,41.38353,2.17055
https://www.airbnb.com/rooms/26242605,Gignas Studio Apartment,8002,"Barcelona, Spain",Spain,41.38164,2.17855
https://www.airbnb.com/rooms/26244319,La Casa Gran B&B. Deluxe large room,8036,"Barcelona, Spain",Spain,41.3931,2.15026
https://www.airbnb.com/rooms/26247209,Plaza de España Arenas Apartment,8015,"Barcelona, Spain",Spain,41.37756,2.14808
https://www.airbnb.com/rooms/26264931,Cozy room with private bathroom,8007,"Barcelona, Spain",Spain,41.38938,2.16471
https://www.airbnb.com/rooms/26268142,Habitación privada en Moderno Apartamento.,8004,"Barcelona , Spain",Spain,41.37186,2.14383
https://www.airbnb.com/rooms/26280936,Private Room-Doble Bed in Amazing Flat,8004,"Barcelona, Spain",Spain,41.37186,2.16229
https://www.airbnb.com/rooms/26284218,Barseloneta Bright double room central & beach,8003,"Barcelona, Spain",Spain,41.37824,2.18732
https://www.airbnb.com/rooms/26299599,small and nice room,8035,"Barcelona, Spain",Spain,41.42439,2.13973
https://www.airbnb.com/rooms/26299665,Comfortable cozy room in the center of Barcelona,8011,"Barcelona, Spain",Spain,41.38595,2.15903
https://www.airbnb.com/rooms/26313903,Smart Studio next to El Born,8002,"Barcelona, Spain",Spain,41.38406,2.17585
https://www.airbnb.com/rooms/26314788,Habitacion en el centro de Barcelona,8003,"Barcelona, Spain",Spain,41.38935,2.18108
https://www.airbnb.com/rooms/26319360,Doble bed in nice apartment,8014,"Barcelona, Spain",Spain,41.38071,2.1318
https://www.airbnb.com/rooms/26319639,Las Ramblas Penthouse Apartment,8002,"Barcelona, Spain",Spain,41.38123,2.17557
https://www.airbnb.com/rooms/26321312,Relax del Mar,8019,"Barcelona, Spain",Spain,41.4144,2.21571
https://www.airbnb.com/rooms/26322430,Quiet and Cozy place in the Downtown,8011,"Barcelona, Spain",Spain,41.3794,2.16636
https://www.airbnb.com/rooms/26326618,Camp Nou Sants Rooms,8028,"Barcelona, Spain",Spain,41.37927,2.13032
https://www.airbnb.com/rooms/26331239,Habitación doble en Gracia,8006,"Barcelona, Spain",Spain,41.39847,2.1528
https://www.airbnb.com/rooms/26345440,Peacefull Room,8032,"Barcelona, Spain",Spain,41.42246,2.17437
https://www.airbnb.com/rooms/26347176,Central & quiet apartment @ Rambla,8007,"Barcelona, Spain",Spain,41.39041,2.16511
https://www.airbnb.com/rooms/26351337,Piso Stefania en Poble Sec,8004,"Barcelona, Spain",Spain,41.37181,2.16546
https://www.airbnb.com/rooms/26352606,Habitación doble en Sagrada Familia,8025,"Barcelona, Spain",Spain,41.40675,2.17663
https://www.airbnb.com/rooms/26362966,Central apartment Eixample dreta,8013,"Barcelona, Spain",Spain,41.40119,2.17532
https://www.airbnb.com/rooms/26363429,Cosy single room by Bunkers del Carmel,8041,"Barcelona, Spain",Spain,41.4182,2.17133
https://www.airbnb.com/rooms/26373550,GREAT APARTMENT IN CITY CENTER (Gothic district),8002,"Barcelona, Spain",Spain,41.38063,2.18035
https://www.airbnb.com/rooms/26375776,Serennia Ramblas-Pl. Catalunya - 3 rooms,8007,"Barcelona, Spain",Spain,41.38587,2.16684
https://www.airbnb.com/rooms/26377825,ROOM WITH PRIVATE TERRACE IN PARALLEL,8004,"Barcelona, Spain",Spain,41.37232,2.16874
https://www.airbnb.com/rooms/26378459,"Centric room w bathroom, San Antoni",8015,"Barcelona, Spain",Spain,41.38096,2.15867
https://www.airbnb.com/rooms/26386867,"Calido ,moderno y con mucha luz.",8015,"Barcelona, Spain",Spain,41.38242,2.15229
https://www.airbnb.com/rooms/26387235,City Beach apartment 3 BARCELONA,8003,"Barcelona, Spain",Spain,41.38106,2.19033
https://www.airbnb.com/rooms/26402690,Penthouse - Atico  - in the Heart of Barcelona,8001,"Barcelona, Spain",Spain,41.37773,2.16839
https://www.airbnb.com/rooms/26405231,P CATEDRAL/PORTAFERRISSA 28,8002,"Barcelona, Spain",Spain,41.38427,2.17149
https://www.airbnb.com/rooms/26408438,Camp nou room Barcelona,8028,"Barcelona, Spain",Spain,41.37961,2.12577
https://www.airbnb.com/rooms/26408463,H MALVINA,8019,"Barcelona, Spain",Spain,41.40902,2.21522
https://www.airbnb.com/rooms/26411040,Sepulveda amazing apartment,8011,"Barcelona, Spain",Spain,41.383,2.16189
https://www.airbnb.com/rooms/26411411,"Bello piso, com buena energia. <3",8026,"Barcelona, Spain",Spain,41.40769,2.18662
https://www.airbnb.com/rooms/26424317,"Habitación, cerca a la estación de La sagrera.",8027,"Barcelona, Spain",Spain,41.42477,2.18581
https://www.airbnb.com/rooms/26424500,BCN Greatest Location Little Cozy Room,8009,"Barcelona, Spain",Spain,41.39548,2.1744
https://www.airbnb.com/rooms/26436015,Loft with city views in the center of Barcelona,8015,"Barcelona, Spain",Spain,41.37675,2.16137
https://www.airbnb.com/rooms/26436233,Great single room in the heart of Montjuic,8004,"Barcelona, Spain",Spain,41.37274,2.17432
https://www.airbnb.com/rooms/26438986,APBCN Big 4bedroom apartment Sagrada Familia (4),8011,"Barcelona, Spain",Spain,41.39986,2.17627
https://www.airbnb.com/rooms/26439674,Deluxe Jr Suite with AC and private bthr La Rambla,8002,"Barcelona, Spain",Spain,41.38565,2.17169
https://www.airbnb.com/rooms/26460064,Comfortable Eixample home in Barcelona,8029,"Barcelona, Spain",Spain,41.3854,2.1443
https://www.airbnb.com/rooms/26460546,Habitación en plaça del sol,8012,"Barcelona, Spain",Spain,41.40216,2.15732
https://www.airbnb.com/rooms/26468577,Exclusive Three Bedroom Apartment w Charming Patio,8014,"Barcelona, Spain",Spain,41.37708,2.13689
https://www.airbnb.com/rooms/26468876,Suite con jardin,8021,"Barcelona, Spain",Spain,41.39831,2.14699
https://www.airbnb.com/rooms/26488006,habitacion 2 en el barrio del borne de  barcelona,8003,"Barcelona, Spain",Spain,41.38919,2.17964
https://www.airbnb.com/rooms/26488228,Confortable room. all serv. very good place in BCN,8018,"Barcelona, Spain",Spain,41.40716,2.1885
https://www.airbnb.com/rooms/26492967,Cozy room for 3,8024,"Barcelona, Spain",Spain,41.41698,2.15822
https://www.airbnb.com/rooms/26493785,VERY bright ROOM,8004,"Barcelona, Spain",Spain,41.37379,2.16443
https://www.airbnb.com/rooms/26511850,Cozy Apartment Barceloneta,8003,"Barcelona, Spain",Spain,41.38193,2.18908
https://www.airbnb.com/rooms/26514955,2BR & 2 Bathroom Flat close to Camp Nou,8021,"Barcelona, Spain",Spain,41.39521,2.14298
https://www.airbnb.com/rooms/26526273,Double room with private bathroom in Barcelona,8023,"Barcelona, Spain",Spain,41.41594,2.14311
https://www.airbnb.com/rooms/26526346,"Room in the centre, near to Sagrada Familia",8018,"Barcelona, Spain",Spain,41.40869,2.18999
https://www.airbnb.com/rooms/26546692,Sunny and Quiet apartment in the heart of Gracia,8024,"Barcelona, Spain",Spain,41.40801,2.15556
https://www.airbnb.com/rooms/26546841,Se alquila habitación doble en el barrio de gracia,8012,"Barcelona, Spain",Spain,41.40166,2.16027
https://www.airbnb.com/rooms/26550368,Your Home in the City Center,8002,"Barcelona, Spain",Spain,41.38651,2.1733
https://www.airbnb.com/rooms/26551159,Chic and Cozy Apartment in Barcelona 8,8021,"Barcelona, Spain",Spain,41.39448,2.1467
https://www.airbnb.com/rooms/26556260,Comfortable room near Plaza Cataluña,8011,"Barcelona, Spain",Spain,41.38246,2.15814
https://www.airbnb.com/rooms/26558608,Habitación con dos camas.Bedroom with 2single beds,8021,"Barcelona, Spain",Spain,41.39113,2.16486
https://www.airbnb.com/rooms/26575276,Habitacion super bonita en Barcelona!!,8032,"Barcelona, Spain",Spain,41.42447,2.17404
https://www.airbnb.com/rooms/26575574,MONUMENTAL VIEWS PENTHOUSE,8013,"Barcelona, Spain",Spain,41.39994,2.18192
https://www.airbnb.com/rooms/26581851,Cozy-Central-Bright up to 4PAX,8013,"Barcelona, Spain",Spain,41.39658,2.17568
https://www.airbnb.com/rooms/26583566,"Habitación  Sagrada FamilIa,  Pqe  Guell, San Pau",8041,"Barcelona, Spain",Spain,41.42139,2.17789
https://www.airbnb.com/rooms/26584836,Nice suite room w/balcony and AC next to la Rambla,8002,"Barcelona, Spain",Spain,41.38544,2.17299
https://www.airbnb.com/rooms/26585100,Sunny room w/balcony next to La Rambla*****2,8002,"Barcelona, Spain",Spain,41.38457,2.17109
https://www.airbnb.com/rooms/26591082,Loft Sagrada Familia,8025,"Barcelona, Spain",Spain,41.41119,2.17232
https://www.airbnb.com/rooms/26591367,En Sagrada Familia Habitacion 1,8013,"Barcelona, Spain",Spain,41.40392,2.17788
https://www.airbnb.com/rooms/26601188,HABITACIÓN CERCA A PLAZA ESPAÑA,8004,"Barcelona, Spain",Spain,41.37052,2.15874
https://www.airbnb.com/rooms/26613280,"Super central & vintage inspired home,huge terrace",8002,"Barcelona, Spain",Spain,41.38631,2.1739
https://www.airbnb.com/rooms/26628669,Luxury Apt + Terrace near Pg Gracia,8009,"Barcelona, Spain",Spain,41.39407,2.17135
https://www.airbnb.com/rooms/26631768,GREAT STUDIO APARTMENT IN GRACIA,8024,"Barcelona, Spain",Spain,41.40547,2.15688
https://www.airbnb.com/rooms/26647285,Bnb,8016,"Barcelona, Spain",Spain,41.44198,2.18186
https://www.airbnb.com/rooms/26647920,Sagrada Familia Luxury Flat for 6,8025,"Barcelona, Spain",Spain,41.40455,2.16798
https://www.airbnb.com/rooms/26651329,PRIVATE ROOM AND NICE ROOMIES,8015,"Barcelona, Spain",Spain,41.37518,2.1652
https://www.airbnb.com/rooms/26651637,Clean and bright room views Sagrada Familia Room1,8013,"Barcelona, Spain",Spain,41.39921,2.18318
https://www.airbnb.com/rooms/26656449,Habitación doble con patio en St. Antoni/Eixample,8015,"Barcelona, Spain",Spain,41.38123,2.15941
https://www.airbnb.com/rooms/26657686,Two rooms for  rent in my beautiful apartment,8002,"Barcelona, Spain",Spain,41.38169,2.17318
https://www.airbnb.com/rooms/26674097,HOLIDAY BEACH BARCELONA LIFE! 2 BIG BR! BALCONY,8003,"Barcelona, Spain",Spain,41.37674,2.19043
https://www.airbnb.com/rooms/26675466,Look no further. This is your place in Barcelona!,8013,"Barcelona, Spain",Spain,41.39675,2.18435
https://www.airbnb.com/rooms/26699614,habitación ciudad meridiana,8033,"Barcelona, Spain",Spain,41.46156,2.17588
https://www.airbnb.com/rooms/26700253,BRAND NEW APARTMENT,8019,"Barcelona, Spain",Spain,41.41527,2.19612
https://www.airbnb.com/rooms/26712619,Acogedora habitación privada en Barcelona,8016,"Barcelona, Spain",Spain,41.42963,2.17665
https://www.airbnb.com/rooms/26712885,Habitación doble en l'Eixample 3 - Barcelona,8029,"Barcelona, Spain",Spain,41.3888,2.14444
https://www.airbnb.com/rooms/26732649,CITY STUDIO IN THE CENTER,8002,"Barcelona, Spain",Spain,41.38552,2.17161
https://www.airbnb.com/rooms/26732910,Coxy room near Sagrada Familia,8025,"Barcelona, Spain",Spain,41.40252,2.1718
https://www.airbnb.com/rooms/26743528,Cozy room in shared flat 5 min walk from the beach,8005,"Barcelona, Spain",Spain,41.39838,2.20486
https://www.airbnb.com/rooms/26744159,A PRIVATE ROOM IN THE  HEART OF BARCELONA 32 days,8001,"Barcelona, Spain",Spain,41.37773,2.16853
https://www.airbnb.com/rooms/26757075,Habitación privada,8014,"Barcelona, Spain",Spain,41.36824,2.1338
https://www.airbnb.com/rooms/26761222,Terrace in Barcelona,8024,"Barcelona, Spain",Spain,41.41072,2.1567
https://www.airbnb.com/rooms/26766866,H CALLE PARIS,8036,"Barcelona, Spain",Spain,41.39487,2.15246
https://www.airbnb.com/rooms/26767140,Downtown Vila de Gracia.,8012,"Barcelona, Spain",Spain,41.4058,2.15818
https://www.airbnb.com/rooms/26773201,Ramblas Port Vell 1 Apartment,8002,"Barcelona, Spain",Spain,41.37697,2.1751
https://www.airbnb.com/rooms/26773433,"Apt. Ramblas, Boqueria. Penthouse, c/ den Roca",8002,"Barcelona, Spain",Spain,41.38289,2.17369
https://www.airbnb.com/rooms/26788741,"Sunny, modern top floor Apartment in Old Town",8003,"Barcelona, Spain",Spain,41.38681,2.17615
https://www.airbnb.com/rooms/26790463,Dormitorio individual luminoso y acogedor,8028,"Barcelona, Spain",Spain,41.3757,2.13075
https://www.airbnb.com/rooms/26792965,2361 - AB Vallespir - Les Corts Apartment - Renovated two bedroom apartment near Camp Nou,8014,"BARCELONA, Spain",Spain,41.38334,2.13545
https://www.airbnb.com/rooms/26793324,Sagrada Familia apartment w/terrace. HUTB-006893,8013,"Barcelona, Spain",Spain,41.40545,2.17595
https://www.airbnb.com/rooms/26800022,"Free parking, ground floor, NEW everything!",8030,"Barcelona, Spain",Spain,41.43688,2.20495
https://www.airbnb.com/rooms/26800315,60 mq flat or two cosy studio apartments with share kitchen and bathroom,8012,"Barcelona, Spain",Spain,41.38562,2.15616
https://www.airbnb.com/rooms/26802172,061. Paseo de Gracia 5 Estrellas 14,8008,"Barcelona, Spain",Spain,41.39507,2.16324
https://www.airbnb.com/rooms/26802330,Blackandwhitehome Gracia Bajos 2,8012,"Barcelona, Spain",Spain,41.40725,2.15392
https://www.airbnb.com/rooms/26809311,Santa Monica Apartment City Center.,8002,"Barcelona, Spain",Spain,41.38106,2.17749
https://www.airbnb.com/rooms/26809924,Central 2BD apartment in Eixample,8009,"Barcelona, Spain",Spain,41.39574,2.17142
https://www.airbnb.com/rooms/26822941,Family Apartment With Large Terrace,,"Barcelona, Spain",Spain,41.39074,2.154
https://www.airbnb.com/rooms/26823085,Blackandwhitehome Gracia Bajos 3,8012,"Barcelona, Spain",Spain,41.40784,2.15246
https://www.airbnb.com/rooms/26828346,APBCN Fantastic Penthouse with Solarium for Groups,8013,"Barcelona, Spain",Spain,41.39742,2.17511
https://www.airbnb.com/rooms/26828389,APBCN Bright and Charming Apartment 2-1,8013,"Barcelona, Spain",Spain,41.39736,2.17645
https://www.airbnb.com/rooms/26833879,Single room just besides Ramblas :),8001,"Barcelona, Spain",Spain,41.37721,2.17364
https://www.airbnb.com/rooms/26837152,"Premium Rooms for GIRLS or FAMILY, Placa España",8015,"Barcelona, Spain",Spain,41.37813,2.15073
https://www.airbnb.com/rooms/26852850,Red Room - Zona Residencial,8035,"Barcelona, Spain",Spain,41.43313,2.14917
https://www.airbnb.com/rooms/26853495,Edificio de varias plantas en Barcelona,8019,"Barcelona, Spain",Spain,41.38998,2.19101
https://www.airbnb.com/rooms/26859365,"Big cozy deco apt, 3BR, WiFi, downtown",8039,"Barcelona, Spain",Spain,41.38088,2.18139
https://www.airbnb.com/rooms/26859637,Monthly rental in Gothic Quarter ready to live in!,8002,"Barcelona, Spain",Spain,41.38083,2.17851
https://www.airbnb.com/rooms/26864675,Gotic neighbourhood apartment,8003,"Barcelona, Spain",Spain,41.385,2.17895
https://www.airbnb.com/rooms/26865335,WONDERFUL APARTMENT IN CENTRE,8015,"Barcelona, Spain",Spain,41.37538,2.16659
https://www.airbnb.com/rooms/26883321,Sants-Montjuic comfort apart with balcony (1842),8014,"Barcelona, Spain",Spain,41.37569,2.14542
https://www.airbnb.com/rooms/26883444,Cozy Double Private room in Plaza Catalunya.,8002,"Barcelona, Spain",Spain,41.38657,2.17324
https://www.airbnb.com/rooms/26892614,Cerca de Park Güell. Con baño privado,8023,"Barcelona, Spain",Spain,41.41573,2.14582
https://www.airbnb.com/rooms/26892947,Quiet Room in Barcelona,8024,"Barcelona, Spain",Spain,41.41083,2.15184
https://www.airbnb.com/rooms/26910446,Sunny home with terrace near the center.,8015,"Barcelona, Spain",Spain,41.38261,2.15095
https://www.airbnb.com/rooms/26912754,Kingsize bed in Private room next to the Sea,8019,"Barcelona, Spain",Spain,41.41449,2.21785
https://www.airbnb.com/rooms/26916997,Triple Room City View Shared Bathroom,8037,"Barcelona, Spain",Spain,41.39755,2.16673
https://www.airbnb.com/rooms/26920348,Plaza España comfort and handy apart (1811),8014,"Barcelona, Spain",Spain,41.37635,2.14718
https://www.airbnb.com/rooms/26933764,Bright and fresh double room in city center,8001,"Barcelona, Spain",Spain,41.37737,2.16698
https://www.airbnb.com/rooms/26934011,Acogedor apartamento en el centro de Barcelona,8014,"Barcelona, Spain",Spain,41.38461,2.13401
https://www.airbnb.com/rooms/26940354,Little room downtown,8010,"Barcelona, Spain",Spain,41.38851,2.17606
https://www.airbnb.com/rooms/26940439,Two Bedroom Apartment next to Sagrada Familia,8013,"Eixample, Spain",Spain,41.40046,2.17094
https://www.airbnb.com/rooms/26946113,Art Gallery Apartment 2B,8004,"Barcelona, Spain",Spain,41.37476,2.16298
https://www.airbnb.com/rooms/26946301,Beautiful and cozy apt in the Eixample,8011,"Barcelona, Spain",Spain,41.38232,2.15769
https://www.airbnb.com/rooms/26970125,Sants-Plaza España apart with a big terrace (1802),8014,"Barcelona, Spain",Spain,41.37654,2.1453
https://www.airbnb.com/rooms/26970811,Beautiful Apartment Sagrada Familia,8013,"Barcelona, Spain",Spain,41.40539,2.18002
https://www.airbnb.com/rooms/26979559,Barcelona Beach House,8003,"Barcelona, Spain",Spain,41.37657,2.1899
https://www.airbnb.com/rooms/26979631,Deluxe Double Room with Breakfast at Hotel OD Barcelona *****,8009,"Barcelona, Spain",Spain,41.39269,2.16779
https://www.airbnb.com/rooms/26980465,Cool app 1 block to the beach!,8003,"Barcelona, Spain",Spain,41.38004,2.19019
https://www.airbnb.com/rooms/26982584,Art Gallery Apartment 4B,8004,"Barcelona, Spain",Spain,41.37425,2.16408
https://www.airbnb.com/rooms/26994244,estudio en Barcelona,8014,"Barcelona, Spain",Spain,41.37604,2.1442
https://www.airbnb.com/rooms/27007407,quarto privado ao lado da Plaza Espana,8004,"Barcelona, Spain",Spain,41.37287,2.15835
https://www.airbnb.com/rooms/27016165,Gignas 1 Apartment,8002,"Barcelona, Spain",Spain,41.37983,2.18005
https://www.airbnb.com/rooms/27016200,Art Gallery Apartment ENT,8004,"Barcelona, Spain",Spain,41.37475,2.16373
https://www.airbnb.com/rooms/27018133,Paseo de Gracia Apartment 1 2,8037,"Barcelona, Spain",Spain,41.39328,2.17044
https://www.airbnb.com/rooms/27018354,"Cozy and Sunny 60m2 BARCELONA,S HEART",8011,"Barcelona, Spain",Spain,41.38372,2.1605
https://www.airbnb.com/rooms/27025305,Cosy double room in lovely penthouse .. Poble Sec,8004,"Barcelona, Spain",Spain,41.37331,2.16579
https://www.airbnb.com/rooms/27030097,Private room in the center of Barcelona,8011,"Barcelona, Spain",Spain,41.38115,2.15909
https://www.airbnb.com/rooms/27041487,Baurent Pangea Center Rambla Cataluña,8008,"Barcelona, Spain",Spain,41.39449,2.16139
https://www.airbnb.com/rooms/27042073,Charming Sunny Apartment Steps to Sagrada Familia,8025,"Barcelona, Spain",Spain,41.40648,2.17408
